{
  "advisory": {
    "advisory_number": "121",
    "canonical_url": "https://www.drupal.org/sa-contrib-2026-121",
    "description_present": true,
    "is_psa": false,
    "kind": "contrib",
    "published_at": "2026-09-02T16:28:20Z",
    "title": "AI translate - Moderately critical - Access Bypass - SA-CONTRIB-2026-121",
    "updated_at": "2026-09-02T16:28:20Z",
    "vulnerability_type": "Access Bypass",
    "year": "2026"
  },
  "advisory_contract_version": "0.1",
  "affected_versions": {
    "clauses": [
      {
        "constraints": [
          {
            "operator": "lt",
            "source_value": "<1.3.2",
            "version": "1.3.2"
          }
        ],
        "source_value": "<1.3.2"
      },
      {
        "constraints": [
          {
            "operator": "gte",
            "source_value": ">=1.4.0",
            "version": "1.4.0"
          },
          {
            "operator": "lt",
            "source_value": "<1.4.1",
            "version": "1.4.1"
          }
        ],
        "source_value": ">=1.4.0 <1.4.1"
      }
    ],
    "parse_method": "drupal_security_advisory_constraint_grammar",
    "source_value": "<1.3.2 || >=1.4.0 <1.4.1",
    "state": "parsed"
  },
  "cves": {
    "identifiers": [
      "CVE-2026-84913"
    ],
    "inferred": false,
    "state": "sourced"
  },
  "enforcement": {
    "automatically_blocking": false,
    "intent": "guidance",
    "policy_controlled": true
  },
  "engine": {
    "deterministic": true,
    "language_model_used": false,
    "name": "drupal-knowledge-security-engine",
    "version": "0.1"
  },
  "fixed_in": {
    "release_nids": [
      "3620427",
      "3620428"
    ],
    "state": "stated",
    "versions": [
      "1.3.2",
      "1.4.1"
    ]
  },
  "id": "SA-CONTRIB-2026-121",
  "is_general_knowledge_record": false,
  "is_trusted_knowledge": false,
  "project": {
    "composer_package": "drupal/ai_translate",
    "drupal_project_nid": "3462387",
    "identity_state": "resolved",
    "machine_name": "ai_translate",
    "project_type": "project_module",
    "resolution": "authoritative_project_node",
    "resolved_from": "https://www.drupal.org/api-d7/node/3462387.json"
  },
  "provenance": {
    "acquisition_channel": "external_authoritative_source",
    "ingest_run_id": "security.20260908T185627.fcceb306",
    "ingested_at": "2026-09-08T18:56:27Z",
    "ingested_by": {
      "name": "drupal-knowledge-security-engine",
      "version": "0.1"
    },
    "source_id": "drupal-security-advisories-recent",
    "source_node_id": "3618946",
    "source_snapshot_sha256": "sha256:ff1e03172279c4ad58d96b45feece3b2d2c931ce6fcb91d975855104b074683c",
    "source_url": "https://www.drupal.org/sa-contrib-2026-121"
  },
  "record_class": "source_derived_authoritative_record",
  "remediation": {
    "authored_by_drupal_knowledge": false,
    "executable": false,
    "fixed_versions": [
      "1.3.2",
      "1.4.1"
    ],
    "source_solution_present": true,
    "state": "sourced"
  },
  "severity": {
    "inferred": false,
    "risk_vector": "AC:Basic/A:User/CI:Some/II:Some/E:Theoretical/TD:Default",
    "scored_by_drupal_knowledge": false,
    "source_field": "field_sa_criticality",
    "state": "sourced"
  }
}
