{
  "advisory": {
    "advisory_number": "012",
    "canonical_url": "https://www.drupal.org/sa-core-2026-012",
    "description_present": true,
    "is_psa": false,
    "kind": "core",
    "published_at": "2026-07-15T19:52:26Z",
    "title": "Drupal core - Moderately critical - Cross-site scripting - SA-CORE-2026-012",
    "updated_at": "2026-07-15T19:52:26Z",
    "vulnerability_type": "Cross-site scripting",
    "year": "2026"
  },
  "advisory_contract_version": "0.1",
  "affected_versions": {
    "clauses": [
      {
        "constraints": [
          {
            "operator": "lt",
            "source_value": "<10.6.13",
            "version": "10.6.13"
          }
        ],
        "source_value": "<10.6.13"
      },
      {
        "constraints": [
          {
            "operator": "gte",
            "source_value": ">=11.3.0",
            "version": "11.3.0"
          },
          {
            "operator": "lt",
            "source_value": "<11.3.14",
            "version": "11.3.14"
          }
        ],
        "source_value": ">=11.3.0 <11.3.14"
      },
      {
        "constraints": [
          {
            "operator": "gte",
            "source_value": ">=11.4.0",
            "version": "11.4.0"
          },
          {
            "operator": "lt",
            "source_value": "<11.4.4",
            "version": "11.4.4"
          }
        ],
        "source_value": ">=11.4.0 <11.4.4"
      },
      {
        "constraints": [
          {
            "operator": "branch_wildcard",
            "source_value": "11.0.*",
            "version": "11.0"
          }
        ],
        "source_value": "11.0.*"
      },
      {
        "constraints": [
          {
            "operator": "branch_wildcard",
            "source_value": "11.1.*",
            "version": "11.1"
          }
        ],
        "source_value": "11.1.*"
      },
      {
        "constraints": [
          {
            "operator": "branch_wildcard",
            "source_value": "11.2.*",
            "version": "11.2"
          }
        ],
        "source_value": "11.2.*"
      }
    ],
    "parse_method": "drupal_security_advisory_constraint_grammar",
    "source_value": "<10.6.13 || >=11.3.0 <11.3.14 || >=11.4.0 <11.4.4 || 11.0.* || 11.1.* || 11.2.*",
    "state": "parsed"
  },
  "cves": {
    "identifiers": [
      "CVE-2026-55805"
    ],
    "inferred": false,
    "state": "sourced"
  },
  "enforcement": {
    "automatically_blocking": false,
    "intent": "guidance",
    "policy_controlled": true
  },
  "engine": {
    "deterministic": true,
    "language_model_used": false,
    "name": "drupal-knowledge-security-engine",
    "version": "0.1"
  },
  "fixed_in": {
    "release_nids": [
      "3611224",
      "3611225",
      "3611226"
    ],
    "state": "stated",
    "versions": [
      "10.6.13",
      "11.3.14",
      "11.4.4"
    ]
  },
  "id": "SA-CORE-2026-012",
  "is_general_knowledge_record": false,
  "is_trusted_knowledge": false,
  "project": {
    "composer_package": "drupal/core",
    "drupal_project_nid": "3060",
    "identity_state": "resolved",
    "machine_name": "drupal",
    "project_type": "project_core",
    "resolution": "authoritative_core_project",
    "resolved_from": "https://www.drupal.org/api-d7/node/3060.json"
  },
  "provenance": {
    "acquisition_channel": "external_authoritative_source",
    "ingest_run_id": "security.20260908T185627.fcceb306",
    "ingested_at": "2026-09-08T18:56:27Z",
    "ingested_by": {
      "name": "drupal-knowledge-security-engine",
      "version": "0.1"
    },
    "source_id": "drupal-security-advisories-core",
    "source_node_id": "3593117",
    "source_snapshot_sha256": "sha256:2416cd08628ca6f8dd5dd873feae9ac23bc4bb709630ef87a5430f737c202dc4",
    "source_url": "https://www.drupal.org/sa-core-2026-012"
  },
  "record_class": "source_derived_authoritative_record",
  "remediation": {
    "authored_by_drupal_knowledge": false,
    "executable": false,
    "fixed_versions": [
      "10.6.13",
      "11.3.14",
      "11.4.4"
    ],
    "source_solution_present": true,
    "state": "sourced"
  },
  "severity": {
    "inferred": false,
    "risk_vector": "AC:Basic/A:User/CI:Some/II:Some/E:Theoretical/TD:Default",
    "scored_by_drupal_knowledge": false,
    "source_field": "field_sa_criticality",
    "state": "sourced"
  }
}
